{
  "schemaVersion": 1,
  "packId": "pack:shared-web.i18n",
  "appliesTo": "official:shared-web",
  "locale": "en",
  "note": "Swappable grammar pack (R46, §9.3/§9.11) for the shared-web line. Two namespaces with a machine-checked wall: 'decision' carries every string the player reads WHILE deciding or losing (type labels, terms, refusals, alerts, status-page rungs) and is written SOBER — §9.3 clause 2 bans jokes inside alerts/build-cards/crisis-prompts, clause 3 bans comedy at the moment of loss. 'flavour' carries recognition comedy for quiet surfaces (ticket inbox, trade press, forums, staff chatter, loading tips, stickies, vendor replies, achievements) — the joke is always the situation, never a person, and never a real product (§9.3 recognition-not-parody). §9.11: the business is depicted, never the technique — abuse exists only as complaint/takedown/upstream-pressure text, zero payloads, commands, or exploit paths. Doc-verbatim strings are marked '(verbatim)' in _provenance cites.",
  "eraCodes": {
    "1998": "The line's founding era as the rendered era axis bites it (bundle availableFrom 2009 is the engine shelf date; §0.4 names the era grid, the four rendered codes follow the OD-22(c) canon). Customer lexicon lives and dies here: webmaster, hit counter, FTP, mail form.",
    "2008": "The cPanel-boom middle (§0.4 names the 2009 shared-hosting-and-cPanel cell; §8.10 dresses the year in gloss). The site was built by a designer, the traffic arrived through a search box or the front page, and the stats are someone else's software.",
    "2016": "The cloud-normal years (§0.4's 2016 cell; §8.10 dresses it flat). Templates and agencies own the customer's site, scheduled jobs run the marketing, and the customer watches an uptime widget you did not build.",
    "2026": "Now: the customer is a growth team or an AI-wrapper site, and the ticket arrives mid-stream. Same box, same thin wall between tenants."
  },
  "slots": {
    "nodeId": { "kind": "entity", "desc": "Board object the decision surface is about (rack/node/service id)." },
    "site": { "kind": "entity", "desc": "The customer's website as they name it." },
    "siteCount": { "kind": "number", "desc": "Accounts or sites on one box." },
    "customer": { "kind": "entity", "desc": "Account holder name as it appears on the invoice." },
    "accountName": { "kind": "entity", "desc": "A person the customer references (developer, son, brother-in-law)." },
    "company": { "kind": "entity", "desc": "Your company, as the industry forum names it." },
    "verb": { "kind": "text", "desc": "Engine intent verb being refused (place/connect/configure/...)." },
    "availableAtTick": { "kind": "tick", "desc": "Tick at which the queued intent or a freed hand presents." },
    "relationKind": { "kind": "text", "desc": "Board relation of a cable (data/power/control/trust)." },
    "slotName": { "kind": "entity", "desc": "Power or card slot designation on a node." },
    "soldAccounts": { "kind": "number", "desc": "Accounts sold onto the box." },
    "capacityAccounts": { "kind": "number", "desc": "Engineered seat count of the box." },
    "affectedAccounts": { "kind": "number", "desc": "Accounts reporting impact right now." },
    "totalAccounts": { "kind": "number", "desc": "Accounts riding the box." },
    "accountCount": { "kind": "number", "desc": "Generic count of accounts in a cohort or notice." },
    "introPrice": { "kind": "money", "desc": "Promo rate locked by the prepay term." },
    "oldPrice": { "kind": "money", "desc": "Price before the increase." },
    "newPrice": { "kind": "money", "desc": "Price after the increase or renewal." },
    "termMonths": { "kind": "number", "desc": "Months of rate held by an annual-prepay lock." },
    "arrivalCount": { "kind": "number", "desc": "Visitors or requests arriving from one fame spike." },
    "replyCount": { "kind": "number", "desc": "Depth of a forwarded mail chain." },
    "changedFiles": { "kind": "number", "desc": "Files touched in the diff the customer swears they did not author." },
    "changedBy": { "kind": "entity", "desc": "Account the attached diff is timestamped under." },
    "changedAt": { "kind": "time", "desc": "When the change the customer denies making was made." },
    "uploadTime": { "kind": "time", "desc": "Timestamp of the FTP session nobody mentions." },
    "weekday": { "kind": "text", "desc": "Day of week the emergency was filed on." },
    "filedAt": { "kind": "time", "desc": "Clock time a ticket was filed." },
    "photoFile": { "kind": "entity", "desc": "Filename of the photograph-of-a-monitor attachment." },
    "upstreamDomain": { "kind": "entity", "desc": "Transit or upstream provider sending the abuse case." },
    "victimDomain": { "kind": "entity", "desc": "Target named in the upstream complaint." },
    "prefix": { "kind": "entity", "desc": "Your address block cited in the abuse case." },
    "caseId": { "kind": "entity", "desc": "Abuse desk case number." },
    "responseHours": { "kind": "duration", "desc": "Hours the abuse desk allows before escalating." },
    "recipientCount": { "kind": "number", "desc": "Mail recipients who never asked." },
    "effectiveTime": { "kind": "time", "desc": "When a null-route or suspension takes effect." },
    "acquirer": { "kind": "entity", "desc": "Company doing the acquiring in press copy." },
    "acquiredHost": { "kind": "entity", "desc": "Host being acquired or closed." },
    "conglomerate": { "kind": "entity", "desc": "Roll-up brand on the acquisition ladder." },
    "rackRow": { "kind": "entity", "desc": "Physical row in the cage." },
    "queueDepth": { "kind": "number", "desc": "Open tickets at handoff time." },
    "windowStart": { "kind": "time", "desc": "Maintenance window opening." },
    "windowEnd": { "kind": "time", "desc": "Maintenance window closing." },
    "noticeNumber": { "kind": "number", "desc": "Which of the four notices this is." },
    "noticeTotal": { "kind": "number", "desc": "How many notices the policy promised." },
    "metric": { "kind": "text", "desc": "Observed metric a cohort watch hangs on." },
    "observationWindow": { "kind": "duration", "desc": "Time a canary cohort is watched before widening." },
    "day": { "kind": "number", "desc": "Day of the quarter, for the intern's log." }
  },
  "decision": {
    "type.shared-web.name": "The Mass Host",
    "type.shared-web.codename": "Cabinet 14",
    "type.shared-web.codex": "The mass line: thousands of small sites sharing boxes, sold on price, kept on patience. Everything that works here works densely — and fails densely. The customer who is on fire cannot be evicted, because evicting them was never in the margin.",
    "visitor.unit.page-load": "page load",
    "goal.shared-web.binding": "One box. Two hundred sites. You cannot evict the customer who is on fire.",
    "scarce.shared-web.qos": "The queue is what holds: every visitor gets the next slot in order, and no account buys position on this box.",
    "skin.shared-web.inspector": "Cutaway of Cabinet 14 — floors of lit windows, and one of them glowing too bright.",
    "economy.shared-web.bad-month": "A slow churn bleed nobody can point at.",
    "verbs.shared-web.transfer.1": "Density vs blast radius; one tenant is everyone's problem.",
    "relations.shared-web.mastery": "You read the noisy neighbour before the elbow forms; triage decisions land one step earlier on crowded boxes.",
    "relations.shared-web.distillate": "Playbook: containment is policy, capacity is arithmetic, and the customer who is on fire stays a customer.",
    "handover.shared-web.runs-out": "Slots run out before disk, and your hands run out before either.",
    "handover.shared-web.kills-you": "One root on the control panel roots two hundred boxes. The enemy is sometimes a client.",
    "handover.shared-web.customer-wants": "Nobody must ever notice them.",
    "rosetta.shared-web.oversell": "Your oversell ratio is the spacing of the teeth on one comb: pack them tighter and the same box 'holds' more sites — until the morning nobody fits.",
    "rosetta.shared-web.density": "Tenant density is windows per floor: every lit window is an account sharing a wall with strangers it will never meet.",
    "scenarios.shared-web.slashdot": {
      "eras": {
        "1998": "A link on a famous front page: {arrivalCount} strangers arrive inside the hour and none of them came for your product.",
        "2008": "The site is voted onto the aggregator's front page: {arrivalCount} people click through in one wave, every one of them a real reader, and the box cannot tell them from an attack.",
        "2016": "A link makes the rounds of a social feed: {arrivalCount} arrive on phones, bounce at the loading bar, and post that the site is broken while it is only busy.",
        "2026": "An aggregator lists the site: {arrivalCount} requests a minute arrive as machines, and the humans were never the majority."
      },
      "fallback": "A link on a famous page: {arrivalCount} strangers arrive inside the hour; free traffic, zero conversion, one very awake operator."
    },
    "scenarios.shared-web.mass-patch-week": "Every CMS in the fleet needs the same patch by the same Tuesday; every one you skip is a door you decided to leave open.",
    "terms.oversell-warning": "This plan carries {soldAccounts} accounts against {capacityAccounts} engineered seats. The margin is booked today; the contention is a probability you are selling.",
    "terms.prepay-lock": "Annual prepay holds {introPrice} for {termMonths} months. Renewal prices at the sheet current on that date — the cliff is in the calendar, not the contract.",
    "terms.price-ladder.1": "Investing in our platform.",
    "terms.price-ladder.2": "Aligning our pricing with the value we deliver.",
    "terms.price-ladder.3": "A modest adjustment.",
    "terms.price-ladder.4": "Your plan is being upgraded.",